caption_id,track_id,caption,is_valid_subset,familiarity,artist_id,album_id,path,duration
786,212013,Electronic music with a political message in the beginning evoking a confused emotion,True,1,337328,31272,13/212013.mp3,210.5
984,219026,"mysterious, alluring and mellow instrumental track that seems from movies or games",True,1,339226,32364,26/219026.mp3,388.0
626,238099,Instrumental rock song that begins with an ambient intro and then progresses through various sections of electric guitars that intensify over time.,True,1,1435,34714,99/238099.mp3,666.0
771,24018,90's dance pop song for a club night back then,True,1,3581,3316,18/24018.mp3,304.6
1043,24018,Electronic instrumental music with a base melody that stays the same throughout the song and other melodies are layered on top that can be used in a club or casual listening,True,0,3581,3316,18/24018.mp3,304.6
359,24026,Instrumental electronic track with a big windy pad holding the structure of the song. Modular leads come in and out of the surface of the track until halfway through the pad disappears and leaves way to a simple drum beat.,,2,3581,3316,26/24026.mp3,452.8
149,242384,"evokes peace and tranquility, without shocks, or emotional disturbances",,1,343767,35540,84/242384.mp3,272.2
923,242384,This is a perfect sound track for a rainy day and tea.,True,2,343767,35540,84/242384.mp3,272.2
473,242410,A chilled out guitar and piano ballad with a gentle snare drum backing.,True,1,343767,35540,10/242410.mp3,296.2
309,242640,An acoustic etherial song with warm vibes in the new folk genre.,True,0,343767,35540,40/242640.mp3,128.5
518,243172,A song inviting to feel and live the present moment and enjoy.,,1,343767,35540,72/243172.mp3,218.4
849,243734,soothing acoustic guitar song that talks feels nostalgic with fingerpicking of the guitar,True,2,343767,35540,34/243734.mp3,205.5
222,246601,"epic song, film and game music, synthetic sound",True,1,343843,35660,01/246601.mp3,144.8
731,24838,"A dissonant blend of birds chirping, and bell-like sounds, then a synth arpeggio that sounds like a jingle for a news flash segment from the 80s on top of a slow, sparse pattern of kicks and cymbals and an oboe-like instrument playing a melancholic melody, all of that with a healthy amount of reverb",,0,2534,3426,38/24838.mp3,291.1
225,25246,"film and game, fantasy music with ethnical instrument (hu lu si?)",,1,2740,3480,46/25246.mp3,211.8
413,25249,"Synthetic orchestral music with hopeful, yearning harmonies, fast pizzicato motifs and woodwind lead",True,2,2740,3480,49/25249.mp3,131.4
232,25250,"Harp, suitable for library, game and film music.",True,0,2740,3480,50/25250.mp3,214.2
615,25254,An instrumental ambiental track that reminds a bit of Moby.,,1,2740,3480,54/25254.mp3,212.1
9,25379,"At first, this track recalls a slow movement of a Mahler symphony - lush, enveloping orchestral strings slowly spinning a mournful dirge - but its lack of melodic direction, and its repetitiveness, suggest that it is movie music.",True,1,2740,3495,79/25379.mp3,134.8
167,25381,Orchestral music with a slow and steady pace that sounds like a soundtrack to a nature movie or documentary.,True,1,2740,3495,81/25381.mp3,151.0
489,25559,"Instrumental folk/post-rock song, with large and strong guitars both acoustic and electric and no drums. The song has a slightly epic feeling, like the one of a lonely traveler in the desert.",True,1,675,3511,59/25559.mp3,247.9
978,257059,Warm repeating melody which seems to be a folk music playing by a band where they greets new visitor.,True,0,6821,36997,59/257059.mp3,127.3
977,260841,"A playful and jazzy song about cats, featuring a funny meow at the beginning.",True,1,345952,37345,41/260841.mp3,174.6
922,264261,Pleasant Electro-pop with missing lyrics. The main melody pad is louder.,,2,338916,37682,61/264261.mp3,242.3
105,264261,"80s instrument set, solid bass-line,  a bit like keygen music.",,1,338916,37682,61/264261.mp3,242.3
304,26431,"Typical videogame music that would work especially in the initial levels, when the adventure is about to start. Strong percussions with a distant brassy melody and a strong string and pad base, with an hopeful and cheerful atmosphere",,2,2740,3620,31/26431.mp3,108.8
656,26432,A song that leads one to a fantastic land where some supernatural creatures are right around the corner to show you their curiosities.,,1,2740,3620,32/26432.mp3,132.5
355,26440,"Cinematic music with percussions, brass and strings. It would be perfect in a videogame during a battle phase as a background, with you controlling the hero and fighting enemies. It ends with a kettledrum solo part.",,1,2740,3620,40/26440.mp3,114.0
991,272434,Haunting expansive sound as if you are in space,True,0,346071,38595,34/272434.mp3,517.4
954,276988,A track with brit rock essence accompanied with pan flute melody.,True,1,347328,39044,88/276988.mp3,292.3
437,285381,"This classical piece has interesting pacing and dynamics- it is not particularly fast and does not feature an extremely wide dynamic range, but it is also far from sleepy. Overall, the tempo is moderate, with a fairly complex interplay between the instruments which keeps things stimulating. The mood is somewhat relaxed, but also thought-provoking.",,0,347596,39788,81/285381.mp3,690.8
802,285434,"Classical symphony, sounding like someone is doing something hastily",True,0,347596,39788,34/285434.mp3,335.8
58,285485,"A string ensemble starts of the track with legato melancholic playing. After two bars, a more instruments from the ensemble come in. Alti and violins seem to be playing melody while celli, alti and basses underpin the moving melody lines with harmonies and chords. The track feels ominous and melanchonic. Halfway through, alti switch to pizzicato, and then fade out to let the celli and basses come through with somber melodies, leaving the chords to the violins.",,1,347596,39788,85/285485.mp3,375.7
951,285674,A classical track performed on an electric piano.,True,2,347598,39797,74/285674.mp3,347.4
999,296235,Electronic music that feels like its in a futuristic world with a melancholy element from the violin until the drums kick in at the very end,True,0,348064,40689,35/296235.mp3,306.8
431,296235,Electro ambient track with no drum beat until the end of the song. The track is sustained by a gaunt synth arp and a string lead track that moves into the drum machine beat at the end.,,1,348064,40689,35/296235.mp3,306.8
469,296236,"Futuristic experimental song with piano over a drum and bass rhythm, with an accordion added towards the middle of the song.",True,1,348064,40689,36/296236.mp3,223.9
7,296237,"An instrumental track that starts out with dreamy string instruments, flutes and synths over an upbeat hip hop beat, while in the second half, a piano kicks in and gets more dominant and dynamic throughout, evoking melancholic feelings.",True,0,348064,40689,37/296237.mp3,250.6
512,296237,"An emotional instrumental piece consisting of electronic instruments of piano, drums and violin.",True,0,348064,40689,37/296237.mp3,250.6
883,296238,this song has a slightly melancholy and minor feeling with the piano at the beginning. it continues with a consistent bass and drum rhythm which is sort of uplifting. there is a rhythm change from 6/8 to 4/4.,,1,348064,40689,38/296238.mp3,289.1
752,296238,"this song starts with an emotional piano melody and then drops into a kind of DnB track with drum break samples and a thumping bass, keeping the piano and later on it has a drum break, whe a violin is added.",True,1,348064,40689,38/296238.mp3,289.1
967,296238,Starts with a melancholic piano with a breakbeat coming in around 30 seconds,True,0,348064,40689,38/296238.mp3,289.1
570,296241,Electronic instrumental track with windy samples and square flangered sounds. A strong drum beat keeps the main lead going through the song until the bass comes in. The song has the atmosphere of rainy cyberpunk scenarios.,,1,348064,40689,41/296241.mp3,261.4
648,304772,A fun track which combines rock and latin elements but could definitely use less instruments.,,1,348448,41508,72/304772.mp3,159.2
34,304775,"Bossa nova or samba duet with jazzy chords on a nylon guitar, and maracas",True,1,348448,41508,75/304775.mp3,230.8
791,305160,An upbeat song with a latin or salsa feel,True,1,348448,41508,60/305160.mp3,154.7
597,3112,"Genre seems like a space music and I feel confused and feels like I'm in the space, somewhere like black-hole",,0,286,485,12/3112.mp3,341.0
524,313059,Bright synth swooshes in the opening followed by a prominent acoustic guitar and a happy-go-lucky bass-line and beat creating a light and breezy feeling evoking a shopping mall or tourist cafe.,True,0,336640,42376,59/313059.mp3,320.0
102,313061,It sounds like someone is experimenting with their newest electronic instrument sets.,,0,336640,42376,61/313061.mp3,290.2
894,330650,This is an electro track with punchy drums and a synth that makes you want to dance.,True,0,349673,44185,50/330650.mp3,296.3
724,330655,This type of song fits in Hip hop and ideally suited to place it in vlog kind of content. Instrumentation is more.,,1,349673,44185,55/330655.mp3,210.8
784,330655,Electronic music that can be listened to in a passive setting,True,1,349673,44185,55/330655.mp3,210.8
1027,33322,An instrumental song that has a bass similar all the song. It's like a loop music.,,0,4658,4117,22/33322.mp3,257.6
1068,33323,Electronic instrumental that has a consistent beat and a melody that at times has a descending pattern which can be used for a soundtrack,True,0,4658,4117,23/33323.mp3,312.6
1048,33324,This midi electronic instrumental has a hopeful and optimistic vibe with melodies that mostly repeat for 4 bars,True,0,4658,4117,24/33324.mp3,315.8
509,33325,This song has a sweet melody made of electronic organs and is accompanied with a salient drumkit.,True,0,4658,4117,25/33325.mp3,289.5
1004,33326,A fuzzy and dampened electronic piece which progressively brightens throughout the track.,True,1,4658,4117,26/33326.mp3,315.6
823,337825,Eerie and anxious feel that picks up with various sample instruments in a loop,True,1,5104,44749,25/337825.mp3,419.9
54,33836,"the first few seconds give off a mystic feeling with the chimes and the intermittent bass. The synth starts strong then recedes into the background. Overall, the highly reverberated and delayed flutes, percussions and chimes give the track almost an ethnic vibe.  Halfway through, the track picks up with hi-hats and feels less mystical - more upbeat.",,0,4488,4157,36/33836.mp3,337.4
785,344323,"Relaxing music played mostly on the piano that can be used while studying, meditating or just relaxing",True,2,350222,45343,23/344323.mp3,180.2
450,344326,A mellow and gentle song that could also be used as a lullaby.,True,1,350222,45343,26/344326.mp3,147.3
123,348881,"Intriguing, slowly progressing electronic tune perfectly match for an indie platform game",True,1,6568,45788,81/348881.mp3,313.3
226,348881,Library music with bass and percussion instrument looping,True,1,6568,45788,81/348881.mp3,313.3
581,348881,"Electro-ambient track with a simple soft but sharp drum machine beat, the synth parts enter one after the other. The track has a dark but peaceful feeling, of a winter forest at noon in the North, with the light reflecting on the snow and making the trees glow of a blue pale light.",,2,6568,45788,81/348881.mp3,313.3
906,348881,Ambiental song that evokes calm with a progression of stereo electronic elements.,True,1,6568,45788,81/348881.mp3,313.3
143,352685,A peaceful piano piece for relaxing by the fireplace.,True,1,350716,46157,85/352685.mp3,65.5
322,352691,Piano solo song that transmits melancholic and nostalgic  feelings,True,0,350716,46157,91/352691.mp3,167.6
927,352694,Piano ternary piece with a repetitive and dynamic pattern that modulate overtime with some 3-for-2 parts,True,2,350716,46157,94/352694.mp3,94.0
377,35349,This weird track starts with a midi piano that sounds like a guitar or vice versa.,False,1,4927,4301,49/35349.mp3,184.3
719,35349,"beautiful song with dreaming melodies, gives you hope and beautiful feelings, with a retro taste, acid guitar to do a trip",,1,4927,4301,49/35349.mp3,184.3
897,35350,"This is a calm pop song with drums, synth and guitar.",True,1,4927,4301,50/35350.mp3,200.1
28,354778,"Fast beat, hip hop, upbeat that has a positive vibe.",True,0,339779,46325,78/354778.mp3,247.4
24,354778,a danceable electronic track in the genre of dance,True,0,339779,46325,78/354778.mp3,247.4
919,354913,Pleasant instrumental song. You will get hooked instantly.,,2,347954,46349,13/354913.mp3,226.0
943,356441,"Reggae beat but with a blues rock element that can be used for various environments such as relaxing, background music in a bar, driving etc.",True,1,340710,46485,41/356441.mp3,243.1
553,357192,A happy Latin song with a strong rhythmic and percussive component that invites you to dance and enjoy.,True,2,350883,46522,92/357192.mp3,197.9
571,357330,Cumbia bailable (Latin music) in a lament tone with lead accordion and brass section.,True,2,350883,46522,30/357330.mp3,195.2
871,357361,"A salsa song with the distinctive cowbells that are the metronome. I am not very pleased with the mix of the percussion and would definitely need more syncopation for the bass line and more focus on the second and fourth beat. Apart from that, it is a very happy tune  that I would find myself dancing through in a latin night. I can't help but smile when I listen to that genre",,1,350883,46522,61/357361.mp3,156.9
589,357361,"Latin American pop folk song with a chaotic mix of percussions, accordions and brass. It has a jolly feeling, humorous, like a song you would play at the village Sunday party.",,1,350883,46522,61/357361.mp3,156.9
707,357365,"A Latin American song with accordion and trumpets and a swaying, but heavy feel.",True,0,350883,46522,65/357365.mp3,218.8
876,359653,Classical instrumental piano that gives a range of emotions from soothing to tension,True,0,347016,46718,53/359653.mp3,146.1
950,359655,A joyful classical track performed on a grand piano.,True,2,347016,46718,55/359655.mp3,571.1
73,359656,"Classical piano piece in major key with a slow start, played beautifully without other instruments, making you close your eyes and find inner peace.",True,1,347016,46718,56/359656.mp3,474.5
79,359657,This gentle melody describes a dream where the subject gets to do things he/she always wanted  to do.,False,1,347016,46718,57/359657.mp3,271.3
795,359659,"Neoclassical Piano 
Solo in a room no accompaniment 
Dynamic night time love ballad",,0,347016,46718,59/359659.mp3,301.6
1077,359660,Deeply emotional classical piece of music for solo piano with a lively interlude,True,0,347016,46718,60/359660.mp3,125.6
701,359662,initially calm and slightly solemn solo piano with pronounced quick double attacks on some notes making it more lively later on,True,1,347016,46718,62/359662.mp3,467.8
43,359664,"This is a solo piano piece with a somewhat melancholic mood. It's slow, with blocks of minor chords driving the melody forward. It reminds me of a Beethoven sonata or something like that.",,2,347016,46718,64/359664.mp3,155.4
313,360978,"This is a chill folk song with a simple rythm and acoustic guitar, good for a slow morning of reading or working.",True,1,343767,46816,78/360978.mp3,192.9
546,363326,"It's a folk song with country vibe, major chord, and rock drum kit.",True,1,348998,47042,26/363326.mp3,323.1
1001,364090,an uplifting jazz song that makes your head shake,True,2,7063,47072,90/364090.mp3,152.7
757,366014,Heavy distorted lead guitar with sparsely supporting piano and distant sounding drums in the background,True,0,348291,47223,14/366014.mp3,205.3
1096,376240,Metal song that could be played in a motorway bar full of rough-looking bikers.,True,1,2320,47990,40/376240.mp3,283.7
269,376419,"A cheesy instrumental love song, with a mellow synth intro and an acoustic guitar riff followed by a lead synth playing chords and an acoustic guitar solo.",True,0,341459,48023,19/376419.mp3,234.7
1024,376422,Instrumental with mostly piano that has a melancholic feel which can be heard alone,True,1,341459,48023,22/376422.mp3,172.5
193,378306,An ambient track perfect for meditations and focus tasks.,True,1,336640,48163,06/378306.mp3,317.8
31,38019,"electronic music with glassy synthesizer and stereo effects, and various textured synth leads",True,2,3901,4669,19/38019.mp3,164.5
244,387501,The song starts with an acoustic guitar and then a electric guitar is added. It is an ambient rock song.,True,0,352042,48909,01/387501.mp3,218.0
387,387516,"The song has a very happy and relaxing vibe. It is an alternative rock instrumental song, that has guitar drums and bass and pad synth. The songs sounds emotional and motivating",,1,352042,48909,16/387516.mp3,190.7
765,38768,Music to accompany a documentary about the ins and outs of being a baboon.,,1,1780,4755,68/38768.mp3,70.6
941,389520,Instrumental mainly focused on clean electric guitar sound riffs and melody which might be fun to listen to on the background,True,2,352114,49104,20/389520.mp3,113.8
379,391307,Creepy electronic track gives a sensation of suspense and intrigue.,True,1,342618,49247,07/391307.mp3,228.1
662,397582,A luminous and moving instrumental piece for piano.,True,1,352409,49715,82/397582.mp3,167.1
368,402055,Instrumental piece with some baroque-era musical arrangements that could well be used in the opening credits of a period film.,True,1,2740,50033,55/402055.mp3,185.9
332,402056,"Elegant and fragile piece of orchestral instrumental music for a film soundtrack set in the Middle Ages or in an Asian country, with a melody played by a violin accompanied by plucked strings.",True,2,2740,50033,56/402056.mp3,109.2
330,402058,"An orchestral work with a solemn, leisurely character in the style of a film soundtrack.",True,2,2740,50033,58/402058.mp3,210.3
845,402063,"Grand, ambitious movie music with powerful, march-like drum beats, as well as brass melody.",True,2,2740,50033,63/402063.mp3,122.9
436,402063,This is a villainous military march with a strong rhythmic feel,True,0,2740,50033,63/402063.mp3,122.9
61,40279,A track with a funky bassline and distorted lead synths that feels very chaotic and busy.,True,0,5678,4956,79/40279.mp3,322.9
595,409692,Genre seems to be hippy music and I feel joy and reminds me of San Francisco hippy area,,0,352880,50691,92/409692.mp3,134.8
385,415590,"The song is instrumental, and is an hip hop beat. It has pads, drums, strings and a breakbeat kind of vibe. The synth that phasor on it makes the beat feel mysterious",,1,353120,51331,90/415590.mp3,120.2
573,415590,Ambient music with acoustic drums and chilling vibe.,True,1,353120,51331,90/415590.mp3,120.2
271,415590,"An instrumental trip hop track, with a slow electronic beat dominated by synth pads, delayed guitar and guitar effects.",True,1,353120,51331,90/415590.mp3,120.2
684,415590,An instrumental trip-hop song well suited for playing in the background while driving in a desert road.,True,1,353120,51331,90/415590.mp3,120.2
534,415597,An instrumental trip-hop beat accompanied with some reversed soundscapes great fit for chilling or sipping a cocktail.,,2,353120,51331,97/415597.mp3,166.7
917,415597,"The track intro reminds me to Radiohead, then when the groove starts it sounds like Primal Scream.",,1,353120,51331,97/415597.mp3,166.7
152,415597,90s hip hop with a moody synth which gives a very ominous but danceable vibe to it.,True,0,353120,51331,97/415597.mp3,166.7
898,415597,"This is a very dreamy and meditative track with an intro composed of long synth notes, later joined by a soft and repetitive drums beat.",True,1,353120,51331,97/415597.mp3,166.7
931,415600,"A meditative track with some reggae influences, composed by a very repetitive drums/guitar pattern and some dreamy notes made by asian instruments",True,0,353120,51331,00/415600.mp3,291.9
913,415600,This song has rhythmical beat and makes me feel  mysterious,True,1,353120,51331,00/415600.mp3,291.9
601,415600,Genre seems like a jazz music played with drums and reminds me of africa town where people all gather and have a traditional dance party,,0,353120,51331,00/415600.mp3,291.9
955,415600,A track that reminds of the golden era of latin rock.,True,2,353120,51331,00/415600.mp3,291.9
52,415600,It's sounds somewhat like a ska track with the rythm guitar in the background. Percussions are peculiar with what sounds like bongos. The bass and flanged guitar give the track a sort of atmospheric vibe.,,0,353120,51331,00/415600.mp3,291.9
150,415605,"sounds quite groovy,  dark atmosphere but no violent, just minimalist.",,1,353120,51331,05/415605.mp3,167.1
566,415605,Downtempo buddha bar track with a jazzy touch. The drum machine beat is accompanied by a sub bass pad and an ethereal saxophone leads while the cymbals keep the beat running.,,1,353120,51331,05/415605.mp3,167.1
386,416358,"This is an electronic song, it is also instrumental song. It starts with a drum loop with snare kick and hihat, after that it introduces synths pads and other electronic songs. The vibe of this song feels very old maybe around 2000s",,1,338916,51271,58/416358.mp3,338.8
294,418240,"This somewhat experimental electro track features handclaps, a layering of multiple synth loops and a repetitive pattern.",True,1,343236,51413,40/418240.mp3,216.0
853,425761,Combination of electronic music and melodic lyrics with a sad futuristic sci fi feel,True,0,348064,52039,61/425761.mp3,275.2
57,428529,"A jazzy piano is playing in the foreground. A bass is doing chromatic and moving lines behind, underpinning the piano playing. After a while of jazzy playing, the piano switches to what feels like a more bluesy chord progression. The bass then moves up into a higher register - higher on the neck. The track feels lighthearted and mellow.",,1,340663,52226,29/428529.mp3,141.6
567,428529,"A blues piano track that would be very well suited in a 90s sitcom. The piano occupies the whole track that has a prominent bass line as well, with a general jolly and happy feeling throughout the song.",,0,340663,52226,29/428529.mp3,141.6
637,437791,An  track that's reminiscent of early 2010's popular alternative rock scene.,True,1,353967,53026,91/437791.mp3,222.3
139,437791,The pop song is very emotional and evokes a serious and urgent mood,,1,353967,53026,91/437791.mp3,222.3
347,437794,"Peaceful sounding lo-fi I guess, it gives a feeling of security",True,1,353967,53026,94/437794.mp3,353.9
727,437795,Ambient folk-song leaning heavily on background string orchestra evoking a sense of calm and serenity,True,0,353967,53026,95/437795.mp3,278.2
415,43886,Agitated West Coast rock with brief bass solo and British influence,True,2,4777,5283,86/43886.mp3,129.5
854,457127,Mid tempo blues swing song that one might find in a casual bar setting for people to dance to,True,1,345952,54604,27/457127.mp3,232.3
878,46046,Fast tempo electronic music with a melody that repeats consistently,True,0,4658,5537,46/46046.mp3,135.3
380,461012,"This electronic track combines synths with guitar, builds up slowly and then bangs it with a electric guitar solo.",True,1,352042,54952,12/461012.mp3,281.5
564,461012,Intro with a spy movie vibe that gives way to an instrumental rock track with a melodic electric guitar solo.,True,1,352042,54952,12/461012.mp3,281.5
10,461012,"starts with guitar ostinato over a descending cyclic minor harmonic progression, inducing some melancholic tension, after which the B section consists of a lyrical heavy rock / metal guitar solo",True,1,352042,54952,12/461012.mp3,281.5
850,461012,fast paced and slow paced electric guitar solo that evokes confusion in a rock genre with drums in the later stage of the song,,1,352042,54952,12/461012.mp3,281.5
229,461014,"Game music, library music, strong beat in drums",,0,352042,54952,14/461014.mp3,753.7
960,461015,Instrumental with a positive vibe mostly on electric guitar that switches between distortion and clean tone,True,2,352042,54952,15/461015.mp3,192.6
651,461017,A harsh instrumental rock song which sounds a bit artificial and dull.,True,1,352042,54952,17/461017.mp3,263.0
612,461018,This song starts with a piano and guitar duet going through an emotional phase and then joined with a dramatic electric guitar.,True,1,352042,54952,18/461018.mp3,220.0
659,461544,"An energetic rock and roll song, accompanied by a nervous electric guitar.",True,0,341332,55328,44/461544.mp3,183.4
519,461560,This rockabilly song is energetic and fun to listen to.,,1,341332,55328,60/461560.mp3,217.2
790,464504,cliché western movie music with cheap instruments for when the title of movie appear on screen.,,1,355005,55227,04/464504.mp3,103.4
444,48719,"A self-contained instrumental with a reggae vibe, played mainly on electric guitars, giving way to an electric guitar solo in the middle of the track.",True,1,696,5905,19/48719.mp3,288.0
320,48721,This song is acoustic and soft. It can be used as background in some bar situations. During the whole song a guitar is present.,,1,696,5905,21/48721.mp3,171.0
733,48721,It  is a mellow intrumental track with a lead guitar being very present.,True,0,696,5905,21/48721.mp3,171.0
1065,48721,Instrumental with a jazz feel played with soft drums percussion and think bass guitar tone which can be used to relax while having a glass of wine at home,True,1,696,5905,21/48721.mp3,171.0
693,4880,This is a fast-paced jazzy track featuring piano and a shuffling snare drum beat.,True,1,696,751,80/4880.mp3,214.8
781,4883,Jungle or forest fauna sounds followed by floaty ethnic flute solo on top of some hopeful synthesizer harmonies.,True,2,696,751,83/4883.mp3,249.5
42,492277,A retro-futurist drum machine groove drenched in bubbly synthetic sound effects and a hint of an acid bassline.,True,2,336764,57703,77/492277.mp3,205.1
