caption_id,track_id,caption,is_valid_subset,familiarity,artist_id,album_id,path,duration
29,1180601,"This is a pretty simple track that sounds like it was produced completely on the computer. It's somewhat energetic, could be hip hop but has no lyrics.",,0,7349,142065,01/1180601.mp3,271.1
1105,1180601,"Pretty simple but effective, starts of simple but later when the beats kick in makes head bob,",,1,7349,142065,01/1180601.mp3,271.1
423,1180633,Repetitive dancefloor track with loud synths and a simple beat,True,0,7349,142065,33/1180633.mp3,268.8
235,11839,"Starts with a very country vibe, with two guitars. It is an instrumental song with just two guitar playing. It sounds soothing and relaxing",,0,1780,1749,39/11839.mp3,212.2
107,11841,Slow-paced guitar ballad with clean guitar solos interspersed throughout the composition,True,0,1780,1749,41/11841.mp3,120.4
116,11841,"A peaceful yet emotionally charged instrumental track featuring a blend of calm, acoustic and electric guitars that overlap and intertwine to create a soothing, introspective soundscape that is perfect for relaxing and unwinding, or for providing a poignant, mellow background ambiance during a reflective moment.",True,0,1780,1749,41/11841.mp3,120.4
45,11843,"A soft guitar arpeggio opens this instrumental piece. Then it moves into folksy chord strumming, with a bluesy melody on top.",,1,1780,1749,43/11843.mp3,97.0
326,1187970,Typical energetic and positive EDM song from the early 10s that could be played in a discotheque on a summer night.,True,1,434337,142986,70/1187970.mp3,217.8
13,119345,"This instrumental piece has the qualities of Celtic folk songs, starting off with a harp-like instrument playing a repeating melody before drums come in",True,0,7051,16238,45/119345.mp3,325.5
36,1194312,"Catchy pop song with prominent acoustic guitar strumming, and an organ interlude.",True,2,343767,143735,12/1194312.mp3,172.4
1063,1194314,The song starts with a sad piano riff that has a wavy and mellow feel for someone who was hurt or is depressed that someone can bob their head to slowly in anguish,True,0,343767,143735,14/1194314.mp3,233.1
1104,1194315,"Groovy rhythm with the guitar especially when the bass kicks in, un-noticeable absence of loud snare and kick, poppy and catchy",True,1,343767,143735,15/1194315.mp3,234.5
817,1194315,"Mixture of styles, including African, Brit Pop, Country Pop, and commercial cleaning products.",True,1,343767,143735,15/1194315.mp3,234.5
814,1194316,"A rejected option for the opening music to the TV show, ""Just Shoot Me"", but a successful option for Texas ranch boy meets girl/sheep.",False,1,343767,143735,16/1194316.mp3,237.8
131,1198562,A soothing and lightly melancholic piano composition that makes the listener desire to sing with it.,True,2,462340,144181,62/1198562.mp3,190.2
888,1209452,"Happy optimistic instrumental song with whistles, xylophone and ukulele that can be used to clap and dance along to",True,1,451073,145253,52/1209452.mp3,178.3
405,1210714,"A fun upbeat drums section playing with a keyboard and some electronic horn type noises, feels like the automatic song on a keyboard that you'd play in music lessons",True,1,7063,145414,14/1210714.mp3,147.9
140,1210715,"Upbeat commercial-sounding song with a simple drum rhythm, guitar chords and a simple but spacey-sounding synth melody",True,1,7063,145414,15/1210715.mp3,130.4
443,1210719,Positive and light instrumental pop song with hand clapping.,,0,7063,145414,19/1210719.mp3,182.1
300,1210721,An instrumental surf rock track with a twist. Open charleston beat with strummed guitar and a mellow synth lead. The song is a happy cyberpunk soundtrack.,,1,7063,145414,21/1210721.mp3,185.8
343,1210725,Positive instrumental pop song with a strong rhythm and brass section.,True,0,7063,145414,25/1210725.mp3,160.1
745,1214580,"Classical Piano Jingle Solo, Happy and Fun 145 BPM",,2,432273,145798,80/1214580.mp3,146.0
187,1214580,"This music is piano waltz music of the classical genre and is reminiscent of Chopin, but it is not Chopin's original work.",True,2,432273,145798,80/1214580.mp3,146.0
938,1221997,Calming instrumental played on bass violin and flute that can be put in the background while doing some work or study,True,1,432273,146573,97/1221997.mp3,165.1
341,12301,Energetic bluesy song with a harmonica and horn section in musical dialogue.,True,1,1858,1820,01/12301.mp3,336.0
23,12301,Instrumental song with classical blues chords but played with a big band style.,True,0,1858,1820,01/12301.mp3,336.0
77,12302,"This track conveys a celebratory mood as in a road trip, where one is having time of his/her life exploring new things, discovering their inner thrill-seeker persona.",,1,1858,1820,02/12302.mp3,280.0
613,12303,This is an energetic song featuring brass air instruments and harmonica.,True,1,1858,1820,03/12303.mp3,331.9
1097,1235608,Relaxing jazz music with soothing melody that contains brass instruments and various keyboards.,True,1,340663,148140,08/1235608.mp3,225.6
333,1239507,"Mysterious piece of jazz music for a typical film noir scene, played on piano, bass (and with a trumpet solo section).",True,2,459422,148554,07/1239507.mp3,295.2
263,1241778,"An instrumental rock song, with a bass, electric guitar, and drums. It is a lively, energetic and happy sounding track",,1,474067,148821,78/1241778.mp3,227.7
946,1241783,A rock-solo track suitable for a road trip.,True,2,474067,148821,83/1241783.mp3,241.1
53,1242780,"The waves in the background give the track a lofi feeling. the drums are crunchy and not lack some low-end but are quite present. The piano in the background feels almost improvisational. Overall, it feels like a melancholic boom-bap track.",,0,439567,148948,80/1242780.mp3,289.1
985,124358,"soft and chill acoustic guitar with synthesized drumbeat, instrumental track",,1,337763,17389,58/124358.mp3,212.1
773,1245182,Lounge music for a summer evening on the beach.,True,0,476715,149189,82/1245182.mp3,308.2
523,1245183,An instrumental electronic track with ethereal organs and bouncy drums.,True,1,476715,149189,83/1245183.mp3,385.8
344,1245183,"Electrónica positiva con secuencias de tempo animado  y algo de fantasía futurista en los sintetizadores, graves profundos y agudos brillantes",,2,476715,149189,83/1245183.mp3,385.8
1070,1245183,"Instrumental electronic music with a repetitive melody on synths which is calming, peaceful and relaxing",True,0,476715,149189,83/1245183.mp3,385.8
126,1245184,The composer is experimenting with different instruments in their DAW.,False,1,476715,149189,84/1245184.mp3,295.2
890,1245184,"A medium-paced EDM-style song with an intro by a synthesizer, features some ambient sound and simple drum.",True,0,476715,149189,84/1245184.mp3,295.2
833,1245185,"A pop style synthesized instrumental track with mellow, chorus-like top line, and a prominent drum beat.",True,0,476715,149189,85/1245185.mp3,340.4
541,1245186,"In this song, a tropic back-beat and a lush piano chord is then accompanied with a salient organ to give way into a joyful melody and a beat.",True,1,476715,149189,86/1245186.mp3,357.3
402,1245186,this electronic song with a downtempo of synthy beats feels perfect for a car journey through nature,True,0,476715,149189,86/1245186.mp3,357.3
884,1245189,"this is a so called jazz-hiphop or lounge music. with dreamy synth, piano loop, and drum loops creates a chill and groove vibe. this is instrumental.",,1,476715,149189,89/1245189.mp3,338.2
965,1245190,This song starts with an ambient pad intro with a hip-hop influenced beat dropping halfway through.,True,1,476715,149189,90/1245190.mp3,289.8
223,1245191,"strong beat, relax and danceful music with drums and piano. Library music.",,2,476715,149189,91/1245191.mp3,378.3
837,1254630,"New-era instrumental backing track starting with synth piano, changed meter afterwards, and added in drum beats.",True,1,479140,150083,30/1254630.mp3,237.0
254,1254634,An interlacing guitar rhythm that is matched by a drum beat and then throws in generic lyrics as a background track,True,0,479140,150083,34/1254634.mp3,196.7
636,1264107,"This track featuring a solo piano gives a sense of safety, determinedness and vulnerability.",True,1,355162,151019,07/1264107.mp3,225.6
1000,1266727,The production sounds like it is produced by a beginner.,False,1,359240,151379,27/1266727.mp3,594.8
982,1267288,"upbeat synthesized guitar pop instrumental track, with consistent tempo and rhythm",True,1,451073,151447,88/1267288.mp3,262.2
903,1267288,"Pop song with a classical chord progression in which all instruments join progressively, building up a richer and richer music.",True,2,451073,151447,88/1267288.mp3,262.2
21,1267288,Rock-pop song recorded with a DAW or composed with MIDI due to its quite not natural sounds.,True,0,451073,151447,88/1267288.mp3,262.2
679,1267288,An uplifting instrumental pop song with hand claps.,True,0,451073,151447,88/1267288.mp3,262.2
1058,1269561,The violin feels like its expressing grief about an event but there is also a hopeful element of it from the background bass velocity which subsides at the end,,0,432273,151644,61/1269561.mp3,116.4
628,1269564,Wonderfully emotional soundtrack with a violin carrying the main melody.,True,1,432273,151644,64/1269564.mp3,163.6
926,127590,A traditional heavy metal riff intro with a transition to grunge-like verse.,True,2,1493,18027,90/127590.mp3,231.1
800,127609,"String section playing slow harmonies with a galloping low thus keeping time, very moody",True,0,337893,18018,09/127609.mp3,176.0
1006,1281209,A repetitive musical motif with an electronic keyboard sound which sounds relaxing. Could be used to focus on work.,,1,343154,152813,09/1281209.mp3,200.0
944,1281499,This track is a perfect fit for a video game spot.,,2,442559,152848,99/1281499.mp3,219.5
568,1282564,"Ethnic ambient electronic song, with a strong ethnic percussion beat and a piano leading melody. The song is pretty flat and fades in and fades out without leaving you any particular impression.",,0,430126,152968,64/1282564.mp3,111.2
451,1288067,"This is very Arabic/Turkish kind of music, there is a single string instrument that is plucked with a constant rhythmic drums, and it sounds mysterious",,0,337328,153548,67/1288067.mp3,179.5
561,1296198,Inspirational track that builds as more instruments are added to the song.,True,2,451073,154290,98/1296198.mp3,247.7
1005,1296198,"An optimistic pop song starting with a simple piano pattern and repetitive strumming of an electric guitar. Then, percussion and a melodic guitar are added to  make the track more enthusiastic and exciting.",,1,451073,154290,98/1296198.mp3,247.7
49,1296596,"Reflective and strong major scale piano chords lead into a hall of light strings, airy guitar strums, and an upbeat drum kit. A simulated distorted electric guitar solo pervades before the arrangement starts a minor bridge, leading into an authentic progressive rock electric guitar solo.",,2,366613,154346,96/1296596.mp3,234.0
475,1306909,"A chunky distortion guitar plays, with some sharp attacks and strange resonances, like the sounds from a pinball machine. The guitars drifts somewhat arhythmically.",,0,484685,155361,09/1306909.mp3,31.2
700,1307834,Dynamic and danceable uplifting pop song featuring a catchy beat performed by an acoustic guitar and hand clapls.,True,2,343767,155433,34/1307834.mp3,242.4
838,1307838,"Rock song starting with guitar line, with a catchy refrain.",True,1,343767,155433,38/1307838.mp3,224.1
995,1307839,A prominent distorted acoustic guitar track with some gospel feeling.,True,2,343767,155433,39/1307839.mp3,250.4
454,1313073,A bright and light piece of piano music that conveys innocence and peace.,True,2,432273,155900,73/1313073.mp3,175.2
99,1313212,8-bit melody brings one back to the arcade saloons while keeping the desire to dance.,True,1,455057,155921,12/1313212.mp3,113.8
141,1315725,"An emotional, reverb-heavy track with cinematic strings, simple piano and guitar, and synth patterns for easy-listening",True,1,1058,156138,25/1315725.mp3,275.0
835,1318704,"An upbeat pop instrumental track starting with synthesized piano sound, later with guitar added in, and then a saxophone-like melody line.",True,1,451073,156395,04/1318704.mp3,224.0
580,1320188,"An electronic music track with a dark synth theme and a muffled drum machine beat. The track has a lot of space in the synths, but it feels amateur, not particularly well mixed or well produced.",,1,369180,156535,88/1320188.mp3,365.7
145,1320188,This synth-heavy track reminds of a dramatic scene of an old science fiction movie.,,1,369180,156535,88/1320188.mp3,365.7
323,1321940,This song reminds me some film and movie scenes in which there is a lot of tension and fear,True,0,2740,156685,40/1321940.mp3,148.6
277,132868,"Starting with an electric piano with tremolo, playing jazzy lines as synthetic string pads and bongos provide backdrop; the complex chords drop out to ease into a boom-bap drum groove. Nice track for relaxing and taking a bath after a long day.",,2,336640,18778,68/132868.mp3,148.4
465,132870,"This chill track reminds me of a hypothetical beachy 80s detective tv show because of the synthesisers, and it would probably be playing under epilogue narration.",,1,336640,18778,70/132870.mp3,168.9
395,132870,"This song sounds quite floaty, a bit funky, guitar, nasal sound at the start of the song, it's quite soft feeling. wavering/oscillating background sounds, but funky simple beat at the front, overall quite easy and enjoyable.",,1,336640,18778,70/132870.mp3,168.9
516,1331791,Ambient song with duduk and oriental drums perfect for starting a trip to east.,True,0,348064,157429,91/1331791.mp3,293.9
453,1334807,"This sounds like that free copyright music that is used in most generic youtube videos, the arpeggiated plucks make it feel like that. It is an instrumental song using electronic elements acoustic like guitar and drums",,1,451073,157824,07/1334807.mp3,186.1
1041,1336429,This type of electronic music can be used in a dance club since it builds up fairly quickly and has a dance beat,True,0,424522,157930,29/1336429.mp3,216.0
247,1338443,"It is an Indian/south asian song and it is instrumental. It has keys, tabla, piano and pads. It evokes a relaxing ambient vibe.",,0,369180,158137,43/1338443.mp3,299.4
471,134057,Futuristic jazz track with a saxophone as the main melody.,True,0,337328,19093,57/134057.mp3,128.1
880,1341061,Energetic alternate four piece rock song that you can bob your head to,True,1,360613,158377,61/1341061.mp3,236.8
988,1343442,"synthesized, calm instrumental piece with a spiritual feeling, with a bit of pentatonic scale, shiny but monotonic sound.",True,2,488843,158863,42/1343442.mp3,228.6
703,1347915,a sinister medieval-sounding piece with a synthesized flute or organ and strong downbeats at a marching pace.,True,0,490314,159035,15/1347915.mp3,62.4
789,1350313,Instrumental mainly on flute ideal for a situation where someone is starting on a nature adventure,True,1,490314,159298,13/1350313.mp3,174.1
632,1350853,A musical call to be in the here and now with this deeply spiritual piece.,True,1,337328,159338,53/1350853.mp3,400.0
811,1350951,1950s New York police caper movie. Or music for a commercial about cat food.,False,1,490314,159342,51/1350951.mp3,124.0
521,1350957,A positive instrumental tune to get you up in the morning with a big smile on your face.,True,1,490314,159344,57/1350957.mp3,127.1
472,1353972,Instrumental jazz ensemble with a bossa nova rhythmic vibe that conveys a sense of positivity.,True,0,454165,159621,72/1353972.mp3,34.0
372,1356312,A pop-rock love song from the 80's that conveys a quiet sense of positivity.,True,2,467034,159858,12/1356312.mp3,324.4
618,1356312,Pop rock track that makes one sing while driving.,True,1,467034,159858,12/1356312.mp3,324.4
892,1356313,"This is pop song with drums, synth, electirc guitar and some lyrics, with a classical chord progression and a memorable melody.",True,1,467034,159858,13/1356313.mp3,213.1
870,1356349,"A classic pop-rock straight out of the 70s, with a very straightforward 4/4 drum beat, a very interesting instrumentation and a natural development that leads to the chorus. The very-low register bass piano notes are a very subtle, yet quite interesting feature of this song. It is a very cheerful, promising tune that would help me get up and be ready to roll for my day.",,2,467034,159858,49/1356349.mp3,235.3
555,1356349,A positive and enthusiastic pop-rock song from the 80s featuring reverbered guitars.,True,0,467034,159858,49/1356349.mp3,235.3
3,135657,"A dance music club banger, with a heavy kick, subtle supporting percussion like tabla and bongos, prominent pop synth lines, and a repetitive hook",True,2,338209,19298,57/135657.mp3,238.0
879,135660,Pop upbeat electronic song that one can sing to,,1,338209,19298,60/135660.mp3,208.0
314,135660,"energetic track with a strong groove and synth bass, great to dance to",True,0,338209,19298,60/135660.mp3,208.0
968,135660,A high energy pop track featuring synthesized sounds and rock guitar.,True,1,338209,19298,60/135660.mp3,208.0
119,1356875,This is a very boring track. It doesn't tell me anything and is not inspiring.,False,0,467034,159901,75/1356875.mp3,190.6
921,1357019,"Oh, this track has the adequate guitar effects. Minimal lyrics.",,2,467034,159916,19/1357019.mp3,256.0
979,1357117,Starts with a electronic guitar sound very likely to a 80s rock style which feels like they performs in a live stage.,True,1,467034,159941,17/1357117.mp3,216.8
197,1357118,The rhythm of the song makes you want to dance and transmit a lot of energy as well as happiness,,1,467034,159941,18/1357118.mp3,168.9
961,1357120,Indie rock song from a 4 piece band that has a faster tempo and energetic beat,True,1,467034,159941,20/1357120.mp3,238.9
548,1357120,"wow, what's wrong with this song, it's a bit rough",False,1,467034,159941,20/1357120.mp3,238.9
920,1357120,This track will travel you to the early stages of brit-pop. Its lyrics are funny and memorable.,,2,467034,159941,20/1357120.mp3,238.9
1101,1367174,The song is an instrumental played on electronic midi and has a dark element to it caused by the low bass octave that is prominent throughout the song,True,0,2208,156733,74/1367174.mp3,215.4
644,1382988,This track sounds like the backing track to an informative video about a campaign or a new product.,True,1,483387,162342,88/1382988.mp3,52.0
134,1386744,An instrumental track with a lead electric guitar and synths well suited for drinking a gin on a sunny afternoon by the pool.,True,1,456894,162661,44/1386744.mp3,280.6
364,1388899,This is a shiny lullaby gently performed on a piano.,True,0,494324,162776,99/1388899.mp3,104.6
924,1390266,Not really an improvisation but a mixture of tracks at similar loudness levels that can confuse you a bit.,False,2,358635,163060,66/1390266.mp3,133.3
606,1397143,Genre seems like a band music and reminds me of fun happy party,True,0,439371,163630,43/1397143.mp3,178.5
889,1397144,A high-BPM metal song with a melodic intro riff and solo by an electric guitar.,True,2,439371,163630,44/1397144.mp3,205.3
163,1402647,Instrumental music that could probably be used as a soundtrack of a fantasy movie thanks to the scales played up and down the piano and the strings on the background,True,1,432273,164083,47/1402647.mp3,144.7
6,1402647,A mysterious and magical song made of bells and strings,True,2,432273,164083,47/1402647.mp3,144.7
15,1402657,"A dramatic and dynamic classical orchastric instrumental. Begins with a few string instruments, and slowly builds up into one grand climax.",,1,432273,164083,57/1402657.mp3,156.1
981,14046,"This track feels like OST of a musical movie which is based in London, full of fog and mystery.",True,2,1659,2009,46/14046.mp3,263.8
716,1406830,"trance techno pop with old style effects, with an emotional sad sound, futuristic and ideal for a cyberpunk movie",True,1,365425,164476,30/1406830.mp3,259.3
109,1408401,Smooth jazz song with leading saxophone. Quiet and peaceful with a low acoustic bassline.,,0,496168,164580,01/1408401.mp3,198.9
496,1408401,"A quartet of drums, double bass, piano and saxophone performing a slow and beautiful jazz song perfect for an evening in a café.",True,1,496168,164580,01/1408401.mp3,198.9
599,1408401,Genre seems like a jazz music played with triumph and reminds me of a jazz bar at night playing in the background while people have their conversation,True,1,496168,164580,01/1408401.mp3,198.9
740,145945,"78 BPM Ballad with a long Guitar Solo, Melancholic",,0,338624,20784,45/145945.mp3,193.8
891,145958,"This tracks is composed of a catchy electric guitar riffs alternating with sung parts slightly calmer, is a genre close to metal.",,0,338624,20784,58/145958.mp3,199.4
865,145968,"A soulless pop, ballad song in a raw production form with a catchy, yet overused, minor harmonic sequence. The keyboard is too repetitive and loud and almost shades the whole composition. It would be a good song to be used in an ending credits or a driving scene from a movie.",,1,338624,20784,68/145968.mp3,197.6
1026,145969,Indie rock most likely a 4 piece band that someone can listen to while driving,True,1,338624,20784,69/145969.mp3,168.6
515,145969,A plain boring rock song that’s remnant of 2000’s alternative scene.,,0,338624,20784,69/145969.mp3,168.6
199,146587,This violin song use the change of the tone to create a change of feeling during the track. Starting with a feeling of release with the more highest notes and then passing to an oppressed or sadness feeling during the lowest notes. Definitely a complex violin piece.,,1,338649,20858,87/146587.mp3,322.4
1078,146588,Innocent and playful classical music for orchestra featuring wind musical instruments such as oboes or fagots.,True,0,338649,20858,88/146588.mp3,239.2
168,146590,Classical music piano piece (scherzo) composed by Chopin.,,1,338649,20858,90/146590.mp3,629.6
375,156061,This is an electronic music track with spacey ethereal synths accompanied with string like elements and later drums.,True,1,339061,22408,61/156061.mp3,422.9
807,156061,Unnerving build up using loops of various instruments,,0,339061,22408,61/156061.mp3,422.9
94,171574,One cannot avoid moving the feet and neck listening to this fast and loopy brazilian tune.,True,1,340035,26259,74/171574.mp3,300.2
1025,17170,It has a ballet dance or circus music feel mostly played on the xylophone,True,0,2534,2430,70/17170.mp3,65.4
22,17176,Ambient industrial song recorded with a DAW or composed with MIDI due to its quite not natural sounds.,,0,2534,2430,76/17176.mp3,126.0
176,172017,2000's style urban pop song with synthesised pad and drums.,True,1,339779,25331,17/172017.mp3,194.0
239,172021,"2000s hip-hop track with R&B and reggaeton influences, with a indian/arab-sounding percussive beat and a good flow",True,1,339779,25331,21/172021.mp3,230.0
625,172031,Hip-hop song with a tremendous flow mixed with some rastafarian sections.,True,2,339779,25331,31/172031.mp3,237.9
382,177570,High energy instrumental song with lots of percussion and organ.,,1,340035,26259,70/177570.mp3,276.8
769,177570,Early evening upbeat track for an evening night out before the real dancing start.,,2,340035,26259,70/177570.mp3,276.8
584,181523,"Instrumental electronic ambient track. The song progresses by adding a section on top of each other. A percussion drum machine beat sustains a low frequency arp, toward the end an acoustic guitar comes in. The track has a general dark but dreamy feeling.",,1,340225,27162,23/181523.mp3,324.1
1079,181523,Electronic music with a sci fi feel to it like an event is about to start which is mostly based on various percussion as compared to a melody,True,0,340225,27162,23/181523.mp3,324.1
963,18500,House music with a thought provoking message in the beginning that  eventually builds up and can be used to create the sense of a social revolution,,0,2773,2609,00/18500.mp3,476.7
666,187621,A dynamic instrumental jam with a brass section arrangement that leads into a high energy ska song.,True,1,340494,28044,21/187621.mp3,326.8
782,188296,Upbeat rock guitar song with a punk feel about love,True,2,337296,28190,96/188296.mp3,232.4
1100,190781,An upbeat and happy song for celebration and dancing played mostly on the brass instrument,,0,340663,28540,81/190781.mp3,118.2
933,190781,"A whimsical string arrangement that feels like bouncing through some woods on an adventure in a video game, with a triumphant finish.",True,2,340663,28540,81/190781.mp3,118.2
1085,191044,"Instrumental ambient track with an 80s chillout vibe, featuring bongos and a piano melody.",True,1,4658,28602,44/191044.mp3,188.6
576,201905,"Instrumental folk rock ballad with acoustic guitars and piano on top of a soft drum beat. An harmonica leads the songs that gives Old Wild West vibes, riding a horse in the sunset.",,1,7805,30025,05/201905.mp3,223.4
729,206596,60’s inspired indie song suitable for a warm summers day,True,0,341332,30621,96/206596.mp3,151.0
1067,206609,Indie rock song that starts off on a harmonica which has an upbeat feel but also a sad tone to it that can be listened in a personal setting,True,1,341332,30621,09/206609.mp3,282.6
427,208937,"Buddha-bar electro ethnic instrumental track, with a straightforward drum beat and a sustained pad in background. Sampled strings and woodwinds keep the melody going.",,1,341459,30924,37/208937.mp3,216.0
503,208937,Soothing ambient soundscape with characteristic piano flourishes and a soft drum backdrop,True,1,341459,30924,37/208937.mp3,216.0
1008,208938,An electronic piece with an optimistic and epic motif. Some sounds are reminiscent of underwater worlds or rain forests as portrayed in movies.,,1,341459,30924,38/208938.mp3,349.5
